{"workers": 18,
 "version": 1,
 "validation":
 {"samples":
  [{"same_modules": true,
    "replay_estimate_s": 16.79,
    "replay_error_pct": [50.3, 52.3],
    "rebuilt_modules": 13,
    "rebuild_wall_s": 18.098,
    "rebuild_cpu_s": 22.149,
    "predicted_modules": 13,
    "module_difference": "",
    "module": "Leanprof.Contract",
    "measured_s": [11.171, 11.026],
    "exit_codes": [0, 0],
    "estimate_s": 15.22,
    "error_pct": [36.2, 38],
    "error": "",
    "clean_wall_s": 29.992,
    "clean_cpu_s": 30.185},
   {"same_modules": true,
    "replay_estimate_s": 13.799,
    "replay_error_pct": [52.3, 34.3],
    "rebuilt_modules": 6,
    "rebuild_wall_s": 11.3,
    "rebuild_cpu_s": 13.348,
    "predicted_modules": 6,
    "module_difference": "",
    "module": "Leanprof.Fix",
    "measured_s": [9.06, 10.275],
    "exit_codes": [0, 0],
    "estimate_s": 12.232,
    "error_pct": [35, 19],
    "error": "",
    "clean_wall_s": 17.608,
    "clean_cpu_s": 17.467},
   {"same_modules": true,
    "replay_estimate_s": 9.309,
    "replay_error_pct": [-11.4, -2],
    "rebuilt_modules": 1,
    "rebuild_wall_s": 9.536,
    "rebuild_cpu_s": 10.513,
    "predicted_modules": 1,
    "module_difference": "",
    "module": "LeanprofCli",
    "measured_s": [10.502, 9.502],
    "exit_codes": [0, 0],
    "estimate_s": 9.3,
    "error_pct": [-11.4, -2.1],
    "error": "",
    "clean_wall_s": 8.608,
    "clean_cpu_s": 9.772},
   {"same_modules": true,
    "replay_estimate_s": 6.856,
    "replay_error_pct": [28.2, 34],
    "rebuilt_modules": 2,
    "rebuild_wall_s": 5.937,
    "rebuild_cpu_s": 7.196,
    "predicted_modules": 2,
    "module_difference": "",
    "module": "Leanprof.StaticCopies",
    "measured_s": [5.348, 5.115],
    "exit_codes": [0, 0],
    "estimate_s": 6.369,
    "error_pct": [19.1, 24.5],
    "error": "",
    "clean_wall_s": 9.148,
    "clean_cpu_s": 8.581},
   {"same_modules": true,
    "replay_estimate_s": 5.363,
    "replay_error_pct": [11.8, 6.8],
    "rebuilt_modules": 2,
    "rebuild_wall_s": 5.022,
    "rebuild_cpu_s": 6.191,
    "predicted_modules": 2,
    "module_difference": "",
    "module": "Leanprof.BuildCmd",
    "measured_s": [4.798, 5.021],
    "exit_codes": [0, 0],
    "estimate_s": 5.36,
    "error_pct": [11.7, 6.8],
    "error": "",
    "clean_wall_s": 5.72,
    "clean_cpu_s": 7.066},
   {"same_modules": false,
    "replay_estimate_s": 1.474,
    "replay_error_pct": [-66.5, -66.4],
    "rebuilt_modules": 2,
    "rebuild_wall_s": 3.514,
    "rebuild_cpu_s": 4.492,
    "predicted_modules": 1,
    "module_difference": "rebuilt but not predicted: LeanprofCli",
    "module": "LeanprofBuildShim",
    "measured_s": [4.402, 4.389],
    "exit_codes": [0, 0],
    "estimate_s": 1.148,
    "error_pct": [-73.9, -73.8],
    "error": "",
    "clean_wall_s": 0.772,
    "clean_cpu_s": 0.45}],
  "replay_mean_abs_error_pct": 34.7,
  "replay_max_abs_error_pct": 66.5,
  "mean_abs_error_pct": 29.3,
  "max_abs_error_pct": 73.9,
  "load": {"before": 14.95, "after": 10.69}},
 "targets": ["leanprof"],
 "schema": {"version": 1, "name": "leanprof.build"},
 "provenance":
 {"workload":
  {"inputs": [],
   "executable": "lake build",
   "binary_hash": null,
   "args_hash": "2562621646070af2",
   "args": ["leanprof"]},
  "platform": {"target": "arm64-apple-darwin24.6.0", "os": "macos"},
  "leanprof_version": "0.1.0",
  "lean":
  {"version": "4.35.0", "commit": "eb6cafb7290e8bd5f2937522d8d804f58f02bafc"},
  "git":
  {"rev": "ba149cfef8346d098effcf1d7ef79053e7ded53d",
   "dirty_fingerprint": null,
   "dirty": false},
  "created": "2026-10-28T16:20:32Z",
  "build": {"targets": ["leanprof"], "mode": "build", "clean": true}},
 "parallelism":
 {"time_at":
  [{"seconds": 0.972, "running": 0},
   {"seconds": 9.034, "running": 1},
   {"seconds": 1.422, "running": 2},
   {"seconds": 2.282, "running": 3},
   {"seconds": 3.42, "running": 4},
   {"seconds": 4.398, "running": 5},
   {"seconds": 3.086, "running": 6},
   {"seconds": 0.464, "running": 7},
   {"seconds": 0.124, "running": 8},
   {"seconds": 0.231, "running": 9}],
  "serialized_min_s": 1,
  "serialized":
  [{"start_s": 2.723,
    "running":
    ["cc LeanprofElabDriver",
     "link leanprof-elab-driver",
     "lean Leanprof.Core"],
    "end_s": 4.449},
   {"start_s": 18.745,
    "running": ["lean LeanprofCli", "cc LeanprofCli", "link leanprof"],
    "end_s": 25.37}],
  "profile":
  [[0, 0],
   [0.787, 1],
   [0.807, 2],
   [1.15, 1],
   [1.17, 2],
   [1.442, 3],
   [1.447, 2],
   [1.463, 3],
   [1.674, 2],
   [1.689, 1],
   [2.225, 0],
   [2.241, 1],
   [2.413, 2],
   [2.424, 1],
   [2.438, 2],
   [2.723, 1],
   [3.029, 0],
   [3.045, 1],
   [4.385, 0],
   [4.446, 1],
   [4.449, 2],
   [4.454, 3],
   [4.461, 4],
   [4.467, 5],
   [4.474, 6],
   [4.481, 7],
   [4.866, 6],
   [4.883, 7],
   [4.901, 6],
   [4.92, 7],
   [4.923, 8],
   [4.971, 7],
   [4.997, 6],
   [5.015, 7],
   [5.027, 6],
   [5.045, 5],
   [5.048, 4],
   [5.063, 5],
   [5.066, 4],
   [5.068, 5],
   [5.071, 6],
   [5.073, 7],
   [5.076, 8],
   [5.082, 9],
   [5.313, 8],
   [5.356, 7],
   [5.372, 8],
   [5.4, 7],
   [5.4, 6],
   [5.41, 5],
   [5.673, 4],
   [5.692, 5],
   [6.034, 4],
   [6.053, 5],
   [6.135, 4],
   [6.943, 3],
   [7.056, 2],
   [7.429, 1],
   [7.451, 2],
   [7.455, 3],
   [7.456, 4],
   [7.461, 5],
   [7.521, 4],
   [7.544, 5],
   [8.464, 4],
   [8.483, 5],
   [8.49, 6],
   [9.764, 5],
   [9.788, 6],
   [9.849, 5],
   [11.373, 4],
   [11.395, 5],
   [11.401, 6],
   [12.782, 5],
   [12.935, 4],
   [13.716, 3],
   [14.254, 2],
   [14.273, 3],
   [14.767, 2],
   [14.784, 1],
   [14.786, 2],
   [14.789, 3],
   [14.79, 4],
   [15.884, 3],
   [15.901, 4],
   [15.904, 5],
   [15.968, 4],
   [15.987, 5],
   [16.715, 4],
   [16.731, 5],
   [16.734, 6],
   [17.013, 5],
   [17.216, 4],
   [17.789, 3],
   [18.682, 2],
   [18.745, 1],
   [20.236, 0],
   [20.252, 1],
   [25.009, 0],
   [25.021, 1],
   [25.37, 0]],
  "peak": 9,
  "average": 3.22},
 "other_modules": {"up-to-date": 5},
 "modules":
 [{"state": "built",
   "source": "LeanprofElabDriver.lean",
   "rebuild": {"task_s": 3.566, "jobs": 3, "estimate_s": 3.806},
   "name": "LeanprofElabDriver",
   "max_rss_bytes": 1398915072,
   "job": 0,
   "imports": ["Lean"],
   "duration_s": 1.438},
  {"state": "built",
   "source": "LeanprofBuildShim.lean",
   "rebuild": {"task_s": 0.772, "jobs": 3, "estimate_s": 1.148},
   "name": "LeanprofBuildShim",
   "max_rss_bytes": 412958720,
   "job": 2,
   "imports": ["Leanprof.BuildShim"],
   "duration_s": 0.277},
  {"state": "built",
   "source": "LeanprofLive.lean",
   "rebuild": {"task_s": 12.47, "jobs": 4, "estimate_s": 7.092},
   "name": "LeanprofLive",
   "max_rss_bytes": 654196736,
   "job": 23,
   "imports": ["Lean.Data.Json", "Leanprof.Retained", "Leanprof.Contract"],
   "duration_s": 2.448},
  {"state": "built",
   "source": "LeanprofElab.lean",
   "rebuild": {"task_s": 14.094, "jobs": 4, "estimate_s": 10.085},
   "name": "LeanprofElab",
   "max_rss_bytes": 819347456,
   "job": 34,
   "imports":
   ["Lean.Data.Json",
    "Lean.Environment",
    "Lean.DeclarationRange",
    "Lean.Elab.ParseImportsFast",
    "Lean.Util.Path",
    "LeanprofElabRange",
    "Leanprof.ElabWhy",
    "Leanprof.Contract"],
   "duration_s": 5.771},
  {"state": "built",
   "source": "LeanprofHtml/Assets.lean",
   "rebuild": {"task_s": 5.135, "jobs": 5, "estimate_s": 5.711},
   "name": "LeanprofHtml.Assets",
   "max_rss_bytes": 422526976,
   "job": 14,
   "imports": [],
   "duration_s": 0.427},
  {"state": "built",
   "source": "LeanprofCli.lean",
   "rebuild": {"task_s": 8.608, "jobs": 3, "estimate_s": 9.3},
   "name": "LeanprofCli",
   "max_rss_bytes": 899203072,
   "job": 47,
   "imports":
   ["Lean.Data.Json",
    "Leanprof.Core",
    "Leanprof.Explain",
    "Leanprof.StaticCopies",
    "Leanprof.Fix",
    "Leanprof.Experiment",
    "Leanprof.Judge",
    "Leanprof.Regress",
    "Leanprof.Workload",
    "Leanprof.ElabWhy",
    "Leanprof.FixElab",
    "LeanprofHtml",
    "LeanprofLive",
    "LeanprofElab",
    "Leanprof.BuildCmd"],
   "duration_s": 3.502},
  {"state": "built",
   "source": "LeanprofElabRange.lean",
   "rebuild": {"task_s": 10.522, "jobs": 5, "estimate_s": 9.711},
   "name": "LeanprofElabRange",
   "max_rss_bytes": 448708608,
   "job": 15,
   "imports": ["Lean.Util.Path"],
   "duration_s": 0.564},
  {"state": "built",
   "source": "LeanprofHtml.lean",
   "rebuild": {"task_s": 5.852, "jobs": 4, "estimate_s": 5.299},
   "name": "LeanprofHtml",
   "max_rss_bytes": 529874944,
   "job": 18,
   "imports": ["Lean.Data.Json", "Leanprof.Core", "LeanprofHtml.Assets"],
   "duration_s": 0.75},
  {"state": "built",
   "source": "Leanprof/Core.lean",
   "rebuild": {"task_s": 7.412, "jobs": 6, "estimate_s": 6.806},
   "name": "Leanprof.Core",
   "max_rss_bytes": 269582336,
   "job": 9,
   "imports": [],
   "duration_s": 0.42},
  {"state": "built",
   "source": "Leanprof/Experiment.lean",
   "rebuild": {"task_s": 14.197, "jobs": 7, "estimate_s": 9.854},
   "name": "Leanprof.Experiment",
   "max_rss_bytes": 637845504,
   "job": 38,
   "imports": ["Lean.Data.Json", "Leanprof.Fix", "Leanprof.Judge"],
   "duration_s": 3.366},
  {"state": "built",
   "source": "Leanprof/BuildCmd.lean",
   "rebuild": {"task_s": 5.72, "jobs": 4, "estimate_s": 5.36},
   "name": "Leanprof.BuildCmd",
   "max_rss_bytes": 548241408,
   "job": 44,
   "imports": ["Leanprof.Build", "Leanprof.BuildShim", "Leanprof.Contract"],
   "duration_s": 0.811},
  {"state": "built",
   "source": "Leanprof/ElabWhy.lean",
   "rebuild": {"task_s": 13.168, "jobs": 6, "estimate_s": 10.143},
   "name": "Leanprof.ElabWhy",
   "max_rss_bytes": 527450112,
   "job": 31,
   "imports": ["Lean.Data.Json", "Leanprof.Explain"],
   "duration_s": 1.008},
  {"state": "built",
   "source": "Leanprof/StaticCopies.lean",
   "rebuild": {"task_s": 9.148, "jobs": 4, "estimate_s": 6.369},
   "name": "Leanprof.StaticCopies",
   "max_rss_bytes": 573767680,
   "job": 32,